Symbol,Name,Last Sale,Net Change,% Change,Market Cap,Country,IPO Year,Volume,Sector,Industry
PEI^C,Pennsylvania Real Estate Investment Trust 7.20% Series C Cumulative Redeemable Perpetual Preferred Shares,$5.18,-0.04,-0.766%,,United States,,3075,,
PEI^D,Pennsylvania Real Estate Investment Trust 6.875% Series D Cumulative Redeemable Perpetual Preferred Shares,$5.00,0.0767,1.558%,,United States,,7615,,
PEN,Penumbra Inc. Common Stock,$215.57,5.01,2.379%,8116485352.00,,2015,212225,Health Care,Medical/Dental Instruments
PEO,Adams Natural Resources Fund Inc. Common Stock,$20.05,0.11,0.552%,490555671.00,United States,,83659,Consumer Services,Real Estate Investment Trusts
PFD,Flaherty & Crumrine Preferred and Income Fund Incorporated,$14.13,0.21,1.509%,175162135.00,United States,1991,31077,Finance,Investment Managers
PFE,Pfizer Inc. Common Stock,$54.51,0.27,0.498%,306528616134.00,United States,,51753990,Health Care,Biotechnology: Pharmaceutical Preparations
PFGC,Performance Food Group Company Common Stock,$53.18,1.69,3.282%,8232338558.00,United States,2015,1852975,Consumer Non-Durables,Food Distributors
PFH,Prudential Financial Inc. 4.125% Junior Subordinated Notes due 2060,$23.00,0.14,0.612%,0.00,United States,2020,52434,,
PFL,PIMCO Income Strategy Fund Shares of Beneficial Interest,$10.12,0.00,0.00%,346923720.00,United States,2003,71677,Finance,Finance Companies
PFN,PIMCO Income Strategy Fund II,$8.70,-0.03,-0.344%,668647200.00,United States,2004,149432,Finance,Finance/Investors Services
PFO,Flaherty & Crumrine Preferred and Income Opportunity Fund Incorporated,$11.42,0.24,2.147%,148988358.00,United States,1992,19450,Finance,Finance Companies
PFS,Provident Financial Services Inc Common Stock,$23.81,0.19,0.804%,1836048911.00,United States,2003,1071194,Finance,Savings Institutions
PFSI,PennyMac Financial Services Inc. Common Stock,$55.36,0.18,0.326%,3068211910.00,United States,2013,847316,Finance,Finance: Consumer Services
PG,Procter & Gamble Company (The) Common Stock,$150.15,-0.08,-0.053%,359919415756.00,United States,,15556228,Consumer Non-Durables,Package Goods/Cosmetics
PGP,Pimco Global Stocksplus & Income Fund Pimco Global StocksPlus & Income Fund Common Shares of Beneficial Interest,$9.22,0.36,4.063%,102701580.00,United States,2005,73225,Finance,Finance Companies
PGR,Progressive Corporation (The) Common Stock,$111.22,1.70,1.552%,65052578000.00,United States,,3940320,Finance,Property-Casualty Insurers
PGRE,Paramount Group Inc. Common Stock,$10.66,-0.02,-0.187%,2335664545.00,United States,2014,1837406,Consumer Services,Real Estate Investment Trusts
PGRU,PropertyGuru Group Limited,$8.46,8.46,,0.00,,,259343,,
PGSS,Pegasus Digital Mobility Acquisition Corp. Class A Ordinary Shares,$9.87,-0.01,-0.101%,278827500.00,,2021,20710,,
PGTI,PGT Innovations Inc.,$21.70,-0.15,-0.686%,1299828416.00,United States,2006,434997,Capital Goods,Building Products
PGZ,Principal Real Estate Income Fund Common Shares of Beneficial Interest,$14.72,0.07,0.478%,100286212.00,,2013,6637,Finance,Investment Managers
PH,Parker-Hannifin Corporation Common Stock,$290.39,1.53,0.53%,37308620137.00,United States,,981249,Capital Goods,Office Equipment/Supplies/Services
PHD,Pioneer Floating Rate Fund Inc.,$10.38,0.00,0.00%,128414956.00,United States,2004,52734,Finance,Investment Managers
PHG,Koninklijke Philips N.V. NY Registry Shares,$31.37,-0.02,-0.064%,27297623300.00,Netherlands,,2142507,Health Care,Biotechnology: Electromedical & Electrotherapeutic Apparatus
PHI,PLDT Inc. Sponsored ADR,$33.07,-0.39,-1.166%,7144964479.00,Philippines,,108721,Public Utilities,Telecommunications Equipment
PHK,Pimco High Income Fund Pimco High Income Fund,$5.70,0.02,0.352%,763252800.00,United States,2003,316295,Finance,Finance/Investors Services
PHM,PulteGroup Inc. Common Stock,$48.43,1.08,2.281%,12042165896.00,United States,,4191114,,
PHR,Phreesia Inc. Common Stock,$28.88,0.65,2.303%,1479807157.00,United States,2019,565613,Health Care,Managed Health Care
PHT,Pioneer High Income Fund Inc.,$8.10,0.02,0.248%,237667244.00,United States,,82024,Finance,Investment Managers
PHX,PHX Minerals Inc. Common Stock,$2.70,-0.07,-2.527%,93146290.00,United States,,150919,Energy,Oil & Gas Production
PHYT,Pyrophyte Acquisition Corp. Class A Ordinary Shares,$9.93,-0.01,-0.101%,249801563.00,,2021,88606,,
PIAI,Prime Impact Acquisition I Class A Ordinary Shares,$9.87,0.00,0.00%,306504095.00,,2020,296,Finance,Business Services
PICC,Pivotal Investment Corporation III Class A Common Stock,$9.75,0.00,0.00%,336375000.00,,2021,14119,,
PII,Polaris Inc. Common Stock,$110.26,3.87,3.638%,6621008694.00,United States,,1596534,Consumer Non-Durables,Recreational Products/Toys
PIM,Putnam Master Intermediate Income Trust Common Stock,$3.47,-0.03,-0.857%,177617804.00,United States,1988,64803,Finance,Finance Companies
PINE,Alpine Income Property Trust Inc. Common Stock,$18.95,-0.02,-0.105%,221166189.00,United States,2019,41468,Consumer Services,Real Estate Investment Trusts
PING,Ping Identity Holding Corp. Common Stock,$22.50,0.60,2.74%,1885233983.00,United States,2019,10859403,Technology,EDP Services
PINS,Pinterest Inc. Class A Common Stock,$26.32,1.43,5.745%,17322373821.00,,2019,10882381,,
PIPP,Pine Island Acquisition Corp. Class A Common Stock,$9.86,0.02,0.203%,269163210.00,United States,2021,42294,,
PIPR,Piper Sandler Companies Common Stock,$132.07,3.06,2.372%,2401554012.00,United States,,227721,Finance,Investment Bankers/Brokers/Service
PJT,PJT Partners Inc. Class A Common Stock,$65.32,3.37,5.44%,1549044269.00,United States,2015,378435,Finance,Investment Managers
PK,Park Hotels & Resorts Inc. Common Stock ,$19.03,0.12,0.635%,4495206675.00,United States,2016,4035562,Consumer Services,Real Estate Investment Trusts
PKE,Park Aerospace Corp. Common Stock,$13.85,-0.21,-1.494%,283346209.00,United States,,191268,,
PKG,Packaging Corporation of America Common Stock,$156.47,0.21,0.134%,14635235251.00,United States,2000,1365617,Basic Industries,Paper
PKI,PerkinElmer Inc. Common Stock,$182.39,4.03,2.259%,23009844173.00,United States,,1188429,Health Care,Medical Specialities
PKX,POSCO Holdings Inc. American Depositary Shares (Each representing 1/4th of a share of Common Stock),$59.67,0.18,0.303%,18814986633.00,South Korea,1994,126849,Basic Industries,Steel/Iron Ore
PL,Planet Labs PBC Class A Common Stock,$5.26,-0.07,-1.313%,1381803915.00,,2021,13462292,Capital Goods,Aerospace
PLAN,Anaplan Inc. Common Stock,$50.59,3.56,7.57%,7470201457.00,United States,2018,4014165,Technology,Computer Software: Prepackaged Software
PLD,Prologis Inc. Common Stock,$160.16,3.50,2.234%,118518400000.00,United States,,6604928,Consumer Services,Real Estate Investment Trusts
PLNT,Planet Fitness Inc. Common Stock,$86.43,-0.16,-0.185%,7288786843.00,United States,2015,1403274,Consumer Services,Other Consumer Services
PLOW,Douglas Dynamics Inc. Common Stock,$35.98,1.59,4.623%,826854617.00,United States,2010,230769,Capital Goods,Construction/Ag Equipment/Trucks
PLTR,Palantir Technologies Inc. Class A Common Stock,$12.82,0.50,4.058%,26026117106.00,,2020,59052525,Technology,Retail: Computer Software & Peripheral Equipment
PLYM,Plymouth Industrial REIT Inc. Common Stock,$26.75,-0.38,-1.401%,977531108.00,United States,2017,2052546,Consumer Services,Real Estate Investment Trusts
PM,Philip Morris International Inc Common Stock,$93.90,0.57,0.611%,145528832016.00,United States,,9640088,Consumer Non-Durables,Farming/Seeds/Milling
PMF,PIMCO Municipal Income Fund Common Stock,$12.66,0.12,0.957%,329514480.00,United States,2001,57419,Finance,Finance/Investors Services
PML,Pimco Municipal Income Fund II Common Shares of Beneficial Interest,$11.78,0.04,0.341%,745886040.00,United States,2002,144505,Finance,Investment Managers
PMM,Putnam Managed Municipal Income Trust Common Stock,$7.20,0.05,0.699%,352603001.00,United States,1989,76845,Finance,Investment Managers
PMO,Putnam Municipal Opportunities Trust Common Stock,$11.88,0.01,0.084%,405574741.00,United States,1993,43584,Finance,Finance Companies
PMT,PennyMac Mortgage Investment Trust Common Shares of Beneficial Interest,$16.59,0.21,1.282%,1615440384.00,United States,2009,2314721,Consumer Services,Real Estate Investment Trusts
PMT^A,PennyMac Mortgage Investment Trust 8.125% Series A Fixed-to-Floating Rate Cumulative Redeemable Preferred Shares of Beneficial Interest,$26.65,0.03,0.113%,,United States,,18967,,
PMT^B,PennyMac Mortgage Investment Trust 8.00% Series B Fixed-to-Floating Rate Cumulative Redeemable Preferred Shares of Beneficial Interest,$26.00,0.03,0.116%,,United States,,2510,,
PMT^C,PennyMac Mortgage Investment Trust 6.75% Series C Cumulative Redeemable Preferred Shares of Beneficial Interest,$23.30,-0.16,-0.682%,,United States,,10698,,
PMVC,PMV Consumer Acquisition Corp. Class A Common Stock,$9.87,0.01,0.101%,215906250.00,United States,2020,4726,,
PMX,PIMCO Municipal Income Fund III Common Shares of Beneficial Interest,$10.65,0.00,0.00%,354176400.00,United States,2002,56572,Finance,Trusts Except Educational Religious and Charitable
PNC,PNC Financial Services Group Inc. (The) Common Stock,$192.97,-0.10,-0.052%,80749222563.00,United States,,5381874,Finance,Major Banks
PNC^P,PNC Financial Services Group Inc. (The) Depositary Shares Representing 1/4000th Perpetual Preferred Series P,$25.30,0.02,0.079%,,United States,,84345,,
PNF,PIMCO New York Municipal Income Fund Common Stock,$10.275,0.055,0.538%,80658750.00,United States,2001,6477,Finance,Finance Companies
PNI,Pimco New York Municipal Income Fund II Common Shares of Beneficial Interest,$9.71,-0.01,-0.103%,108781130.00,United States,2002,41837,Finance,Trusts Except Educational Religious and Charitable
PNM,PNM Resources Inc. (Holding Co.) Common Stock,$46.13,0.00,0.00%,3959562738.00,United States,,883830,Public Utilities,Electric Utilities: Central
PNR,Pentair plc. Ordinary Share,$57.22,0.27,0.474%,9446956025.00,Switzerland,,3580316,Capital Goods,Fluid Controls
PNTM,Pontem Corporation Class A Ordinary Shares,$9.787,0.007,0.072%,844128750.00,,2021,1352,Finance,Business Services
PNW,Pinnacle West Capital Corporation Common Stock,$72.97,-1.35,-1.816%,8240642859.00,United States,,2354728,Public Utilities,Electric Utilities: Central
POLY,Plantronics Inc. Common Stock,$28.39,0.81,2.937%,1214492119.00,United States,,614248,Public Utilities,Telecommunications Equipment
POND,Angel Pond Holdings Corporation Class A Ordinary Shares,$9.8101,0.0001,0.001%,325590862.00,,2021,750,,
POR,Portland General Electric Co Common Stock,$53.79,-0.20,-0.37%,4818151626.00,United States,,1149139,Public Utilities,Electric Utilities: Central
PORT,Southport Acquisition Corporation Class A Common Stock,$9.93,0.03,0.303%,285487500.00,,2022,104,,
POST,Post Holdings Inc. Common Stock,$68.23,-0.04,-0.059%,6449197851.00,United States,2012,845970,Consumer Non-Durables,Food Distributors
PPG,PPG Industries Inc. Common Stock,$130.93,2.25,1.749%,30918873483.00,United States,,2522390,Basic Industries,Paints/Coatings
PPL,PPL Corporation Common Stock,$26.67,-0.12,-0.448%,19612101473.00,United States,,22600445,Public Utilities,Electric Utilities: Central
PPT,Putnam Premier Income Trust Common Stock,$3.97,-0.07,-1.733%,405865050.00,United States,1988,392358,Finance,Finance Companies
PRA,ProAssurance Corporation Common Stock,$25.06,0.14,0.562%,1352909233.00,United States,,444781,Finance,Property-Casualty Insurers
PRBM,Parabellum Acquisition Corp. Class A Common Stock,$9.85,0.03,0.305%,48356260.00,,2021,62162,,
PRE^J,PartnerRe Ltd. 4.875% Fixed Rate Non-Cumulative Redeemable Preferred Shares Series J,$23.53,0.26,1.117%,,Bermuda,,17935,,
PRG,PROG Holdings Inc. Common Stock,$30.80,0.49,1.617%,1698864983.00,United States,,2002388,Technology,Diversified Commercial Services
PRGO,Perrigo Company plc Ordinary Shares,$38.26,-0.27,-0.701%,5118603234.00,United States,,1165034,Health Care,Biotechnology: Pharmaceutical Preparations
PRI,Primerica Inc. Common Stock,$133.38,0.79,0.596%,5234340978.00,United States,2010,309444,Finance,Life Insurance
PRIF^D,Priority Income Fund Inc. 7.00% Series D Term Preferred Stock due 2029,$25.0519,0.0314,0.125%,,,,100,,
PRIF^F,Priority Income Fund Inc. 6.625% Series F Term Preferred Stock due 2027,$25.00,0.0023,0.009%,,,,726,,
PRIF^G,Priority Income Fund Inc. 6.25% Series G Preferred Stock Due 2026,$25.10,0.10,0.40%,,,,1200,,
PRIF^H,Priority Income Fund Inc. 6.00% Series H Term Preferred Stock due 2026,$25.00,0.04,0.16%,,,,1432,,
PRIF^I,Priority Income Fund Inc. 6.125% Series I Term Preferred Stock due 2028,$24.8487,0.1287,0.521%,,,,1672,,
PRIF^J,Priority Income Fund Inc. 6.000% Series J Term Preferred Stock due 2028,$24.91,0.06,0.241%,,,,7483,,
PRIF^K,Priority Income Fund Inc. 7.000% Series K Cumulative Preferred Stock,$23.8899,-0.1201,-0.50%,,,,6895,,
PRIF^L,Priority Income Fund Inc. 6.375% Series L Term Preferred Stock Due 2029,$24.68,-0.07,-0.283%,,,,2494,,
PRLB,Proto Labs Inc. Common stock,$54.23,0.66,1.232%,1489530095.00,United States,2012,295968,Capital Goods,Office Equipment/Supplies/Services
PRM,Perimeter Solutions SA Ordinary Shares,$11.60,0.10,0.87%,1893498937.00,,2021,372172,,
PRMW,Primo Water Corporation Common Stock,$14.61,0.33,2.311%,2353037189.00,Canada,,1341257,Consumer Non-Durables,Soft Drinks
PRO,PROS Holdings Inc. Common Stock,$33.13,-0.15,-0.451%,1492116692.00,United States,2007,351649,Technology,EDP Services
PRPB,CC Neuberger Principal Holdings II Class A Ordinary Shares,$9.91,0.00,0.00%,1075235000.00,United States,2020,370724,Finance,Business Services
PRPC,CC Neuberger Principal Holdings III Class A Ordinary Shares,$9.77,-0.02,-0.204%,540403125.00,,2021,400073,Finance,Business Services
PRS,Prudential Financial Inc. 5.625% Junior Subordinated Notes due 2058,$25.8172,-0.0628,-0.243%,879374288.00,United States,2018,24171,Finance,Investment Bankers/Brokers/Service
PRT,PermRock Royalty Trust Trust Units,$8.96,-0.04,-0.444%,109004959.00,United States,2018,89529,Energy,Oil & Gas Production
PRTY,Party City Holdco Inc. Common Stock,$3.69,0.05,1.374%,414947555.00,United States,2015,4734784,Miscellaneous,Diversified Commercial Services
PRU,Prudential Financial Inc. Common Stock,$115.23,-0.17,-0.147%,43326480000.00,United States,2001,5707024,Finance,Life Insurance
PSA,Public Storage Common Stock,$365.71,-0.07,-0.019%,64168298716.00,United States,,1343335,Consumer Services,Real Estate Investment Trusts
PSA^F,Public Storage Depositary Shares Each Representing 1/1000 of a 5.15% Cumulative Preferred Share of Beneficial Interest Series F par value $0.01 per share,$25.10,0.25,1.006%,,United States,,21023,,
PSA^G,Public Storage Depositary Shares Each Representing 1/1000 of a 5.05% Cumulative Preferred Share of Beneficial Interest Series G,$24.99,0.125,0.503%,,United States,,28034,,
PSA^H,Public Storage Depositary Shares Each Representing 1/1000 of a  5.60% Cumulative Preferred  Share of Beneficial Interest Series H,$26.01,0.16,0.619%,,United States,,44115,,
PSA^I,Public Storage Depositary Shares Each Representing 1/1000 of a 4.875% Cumulative Preferred Share of Beneficial Interest Series I par value $0.01 per share,$24.41,0.25,1.035%,,United States,,21466,,
PSA^J,Public Storage Depositary Shares Each Representing 1/1000 of a 4.700% Cumulative Preferred Share of Beneficial Interest Series J par value $0.01 per share,$23.25,0.07,0.302%,,United States,,23728,,
PSA^K,Public Storage Depositary Shares Each Representing 1/1000 of a 4.75% Cumulative Preferred Share of Beneficial Interest Series K,$24.30,0.14,0.579%,,United States,,10067,,
PSA^L,Public Storage Depositary Shares Each Representing 1/1000 of a 4.625% Cumulative Preferred Share of Beneficial Interest Series L par value $0.01 per share,$23.40,0.17,0.732%,,United States,,24292,,
PSA^M,Public Storage Depositary Shares Each Representing 1/1000 of a 4.125% Cumulative Preferred Share of Beneficial Interest Series M,$21.34,0.17,0.803%,,United States,,12319,,
PSA^N,Public Storage Depositary Shares Each Representing 1/1000 of a 3.875% Cumulative Preferred Share of Beneficial Interest Series N,$19.94,0.105,0.529%,,United States,,21188,,
PSA^O,Public Storage Depositary Shares Each Representing 1/1000 of a 3.900% Cumulative Preferred Share of Beneficial Interest Series O,$20.04,0.23,1.161%,,United States,,28214,,
PSA^P,Public Storage Depositary Shares Each Representing 1/1000 of a 4.000% Cumulative Preferred Share of Bene cial Interest Series P,$20.54,0.12,0.588%,,United States,,34699,,
PSA^Q,Public Storage Depositary Shares Each Representing 1/1000 of a 3.950% Cumulative Preferred Share of Beneficial Interest Series Q par value $0.01 per share,$20.4683,0.1083,0.532%,,United States,,12182,,
PSA^R,Public Storage Depositary Shares Each Representing 1/1000 of a 4.00% Cumulative Preferred Share of Bene cial Interest Series R,$20.45,0.145,0.714%,,United States,,27144,,
PSA^S,Public Storage Depositary Shares Each Representing 1/1000 of a 4.100% Cumulative Preferred Share of Beneficial Interest Series S,$20.73,0.24,1.171%,,United States,,15646,,
PSB,PS Business Parks Inc. (MD) Common Stock,$161.29,1.13,0.706%,4452592224.00,United States,,232781,Consumer Services,Real Estate Investment Trusts
PSB^X,PS Business Parks Inc. Depositary Shares Each Representing 1/1000 of a Share of 5.25% Cumulative Preferred Stock Series X,$24.83,0.18,0.73%,,United States,,12119,,
PSB^Y,PS Business Parks Inc. 5.20% Cumulative Preferred Stock Series Y,$24.53,-0.064,-0.26%,,United States,,6698,,
PSB^Z,PS Business Parks Inc. Depositary Shares Each Representing 1/1000 of a Share of 4.875% Cumulative Preferred Stock Series Z  par value $0.01 per share,$23.14,0.22,0.96%,,United States,,18501,,
PSEC^A,Prospect Capital Corporation 5.35% Series A Fixed Rate Cumulative Perpetual Preferred Stock,$20.59,-0.0242,-0.117%,,United States,,10174,,
PSF,Cohen & Steers Select Preferred and Income Fund Inc. Common Stock,$22.16,0.15,0.682%,266509944.00,,2010,30354,Finance,Investment Managers
PSFE,Paysafe Limited Common Shares,$3.66,0.36,10.909%,2648787318.00,,2021,25809574,Miscellaneous,Business Services
PSN,Parsons Corporation Common Stock,$37.56,-0.29,-0.766%,3844666465.00,,2019,2394543,Capital Goods,Industrial Machinery/Components
PSO,Pearson Plc Common Stock,$10.81,0.00,0.00%,8186093597.00,United Kingdom,,588324,Consumer Services,Books
PSPC,Post Holdings Partnering Corporation Series A Common Stock,$9.709,0.009,0.093%,429283435.00,,2021,2482,,
PSTG,Pure Storage Inc. Class A Common Stock,$34.55,0.70,2.068%,10017672443.00,,2015,4475038,Technology,Electronic Components
PSTH,Pershing Square Tontine Holdings Ltd. Class A Common Stock,$19.84,0.04,0.202%,3968001984.00,,2020,1096947,,
PSTL,Postal Realty Trust Inc. Class A Common Stock,$16.93,-0.82,-4.62%,317698611.00,,2019,847133,Consumer Services,Real Estate Investment Trusts
PSX,Phillips 66 Common Stock,$78.76,1.21,1.56%,44054980003.00,United States,,8261776,Energy,Integrated oil Companies
PTA,Cohen & Steers Tax-Advantaged Preferred Securities and Income Fund Common Shares of Beneficial Interest,$21.94,0.14,0.642%,1212699647.00,,2020,139009,Finance,Trusts Except Educational Religious and Charitable
PTR,PetroChina Company Limited Common Stock,$49.41,0.23,0.468%,90430665131.00,China,,214169,Energy,Oil & Gas Production
PTY,Pimco Corporate & Income Opportunity Fund,$14.86,0.05,0.338%,1695674600.00,United States,2002,323766,Finance,Investment Managers
PUK,Prudential Public Limited Company Common Stock,$28.69,0.02,0.07%,39397299334.00,United Kingdom,,434513,Finance,Life Insurance
PUMP,ProPetro Holding Corp. Common Stock,$13.28,-0.01,-0.075%,1377218562.00,United States,2017,2828298,Energy,Oilfield Services/Equipment
PV,Primavera Capital Acquisition Corporation Class A Ordinary Shares,$9.79,0.00,0.00%,526212500.00,,2021,25,Finance,Business Services
PVH,PVH Corp. Common Stock,$83.73,1.78,2.172%,5974950193.00,United States,,1767696,,
PVL,Permianville Royalty Trust Trust Units ,$2.715,-0.035,-1.273%,89595000.00,United States,2011,156198,Energy,Oil & Gas Production
PWR,Quanta Services Inc. Common Stock,$126.56,0.90,0.716%,18058886140.00,United States,,1267018,Capital Goods,Engineering & Construction
PWSC,PowerSchool Holdings Inc. Class A Common Stock,$18.54,1.04,5.943%,2929959574.00,,2021,2022296,Technology,Computer Software: Prepackaged Software
PX,P10 Inc. Class A Common Stock,$11.90,-0.32,-2.619%,1394593689.00,,2021,321569,Finance,Investment Managers
PXD,Pioneer Natural Resources Company Common Stock,$239.86,-1.53,-0.634%,58258159838.00,United States,,4816400,Energy,Oil & Gas Production
PYN,PIMCO New York Municipal Income Fund III Common Shares of Beneficial Interest,$8.28,-0.06,-0.719%,47494080.00,United States,2002,26969,Finance,Investment Managers
PYS,Merrill Lynch Depositor Inc PPlus Tr Ser RRD-1 Tr Ctf Cl A,$24.9877,0.5177,2.116%,0.00,United States,,9281,Finance,Trusts Except Educational Religious and Charitable
PYT,PPlus Tr GSC-2 Tr Ctf Fltg Rate,$22.00,0.00,0.00%,0.00,United States,,1,,
PZC,PIMCO California Municipal Income Fund III Common Shares of Beneficial Interest,$9.20,-0.04,-0.433%,206254800.00,United States,2002,30337,Finance,Investment Managers
PZN,Pzena Investment Management Inc Class A Common Stock,$8.34,-0.03,-0.358%,615843072.00,United States,2007,115847,Finance,Investment Managers
QD,Qudian Inc. American Depositary Shares each representing one Class A Ordinary Share,$1.02,0.04,4.082%,258149962.00,China,2017,2884703,Technology,Computer Software: Prepackaged Software
QFTA,Quantum FinTech Acquisition Corporation Common Stock,$9.89,0.00,0.00%,248795313.00,,2021,32755,,
QGEN,Qiagen N.V. Common Shares ,$49.94,1.12,2.294%,11340051139.00,Netherlands,,1551272,Health Care,Biotechnology: Biological Products (No Diagnostic Substances)
QNGY,Quanergy Systems Inc. Common Stock,$2.37,-0.10,-4.049%,197687262.00,,2020,2167773,Capital Goods,Industrial Machinery/Components
QS,QuantumScape Corporation Class A Common Stock,$17.07,0.55,3.329%,7337349716.00,United States,2020,9252136,Capital Goods,Auto Parts:O.E.M.
QSR,Restaurant Brands International Inc. Common Shares,$58.40,0.52,0.898%,18082543022.00,Canada,2014,3797287,,
QTWO,Q2 Holdings Inc. Common Stock,$62.97,2.18,3.586%,3584783300.00,,2014,745946,Technology,EDP Services
QUAD,Quad Graphics Inc Class A Common Stock,$6.16,0.12,1.987%,344797555.00,United States,,333758,Consumer Services,Recreational Products/Toys
QUOT,Quotient Technology Inc. Common Stock,$6.72,0.07,1.053%,637872399.00,,2014,949727,Technology,Advertising
QVCC,QVC Inc. 6.250% Senior Secured Notes due 2068,$23.08,0.05,0.217%,0.00,United States,2019,28222,,
QVCD,QVC Inc. 6.375% Senior Secured Notes due 2067,$23.64,0.12,0.51%,0.00,United States,2018,9384,,
R,Ryder System Inc. Common Stock,$84.26,0.49,0.585%,4533167693.00,United States,,1002705,Miscellaneous,Rental/Leasing Companies
RA,Brookfield Real Assets Income Fund Inc. Common Stock,$20.81,0.18,0.873%,1042545519.00,,2016,143694,Finance,Investment Managers
RAAS,Cloopen Group Holding Limited American Depositary Shares each representing two Class A Ordinary Shares,$2.02,0.15,8.021%,332027751.00,,2021,1516556,Technology,Computer Software: Prepackaged Software
RACE,Ferrari N.V. Common Shares,$209.61,0.08,0.038%,38422932689.00,,2015,359491,Capital Goods,Auto Manufacturing
RAD,Rite Aid Corporation Common Stock,$9.34,0.11,1.192%,521005505.00,United States,,2637696,Health Care,Medical/Nursing Services
RAMP,LiveRamp Holdings Inc. Common Stock,$39.07,1.19,3.141%,2663669998.00,United States,2018,2683289,Technology,EDP Services
RBA,Ritchie Bros. Auctioneers Incorporated Common Stock,$60.17,-0.13,-0.216%,6656874134.00,Canada,,521128,,
RBAC,RedBall Acquisition Corp. Class A Ordinary Shares,$9.91,0.00,0.00%,712281250.00,United States,2020,71458,Finance,Business Services
RBLX,Roblox Corporation Class A Common Stock,$49.62,3.27,7.055%,29164620088.00,,2021,33911321,Technology,EDP Services
RBOT,Vicarious Surgical Inc. Class A Common Stock,$5.52,-0.03,-0.541%,661125250.00,Hong Kong,2020,490155,Health Care,Medical Specialities
RC,Ready Capital Corproation Common Stock,$15.49,0.02,0.129%,1290757551.00,United States,2013,4001745,Consumer Services,Real Estate Investment Trusts
RC^C,Ready Capital Corporation 6.25% Series C Cumulative Convertible Preferred Stock,$23.0001,0.1051,0.459%,,United States,,481,,
RC^E,Ready Capital Corporation 6.50% Series E Cumulative Redeemable Preferred Stock,$23.4089,0.1689,0.727%,,United States,,3473,,
RCA,Ready Capital Corporation 7.00% Convertible Senior Notes due 2023,$26.77,0.1843,0.693%,0.00,United States,2017,7965,Consumer Services,Real Estate Investment Trusts
RCB,Ready Capital Corporation 6.20% Senior Notes due 2026,$25.62,0.0502,0.196%,0.00,United States,2019,469,,
RCC,Ready Capital Corporation 5.75% Senior Notes due 2026,$25.05,0.01,0.04%,0.00,United States,2021,34709,Finance,Finance Companies
RCI,Rogers Communication Inc. Common Stock,$53.63,-0.24,-0.446%,27079144804.00,Canada,,374838,,
RCL,D/B/A Royal Caribbean Cruises Ltd. Common Stock,$76.18,1.22,1.628%,19426111095.00,United States,1993,4262176,,
RCS,PIMCO Strategic Income Fund Inc.,$5.73,0.00,0.00%,255609570.00,United States,1994,97877,Finance,Investment Managers
RCUS,Arcus Biosciences Inc. Common Stock,$35.95,1.45,4.203%,2554674119.00,,2018,1421399,Health Care,Biotechnology: Pharmaceutical Preparations
RDN,Radian Group Inc. Common Stock,$22.58,-0.16,-0.704%,3963367845.00,United States,,8225606,Finance,Property-Casualty Insurers
RDW,Redwire Corporation Common Stock,$7.57,0.59,8.453%,451635837.00,United States,2021,392013,Capital Goods,Aerospace
RDY,Dr. Reddy's Laboratories Ltd Common Stock,$53.55,0.09,0.168%,8886723710.00,India,,235133,Health Care,Biotechnology: Pharmaceutical Preparations
RE,Everest Re Group Ltd. Common Stock,$286.66,1.48,0.519%,11257672534.00,Bermuda,,479065,Finance,Property-Casualty Insurers
RELX,RELX PLC PLC American Depositary Shares (Each representing One Ordinary Share),$30.52,0.36,1.194%,58971276818.00,United Kingdom,2015,1099082,Consumer Services,Publishing
